{
  "$schema": "https://json-schema.org/draft/2020-12/schema",
  "$id": "https://pathos.example/schemas/v1/ranking-pilot-coverage-matrix.json",
  "title": "PathOS pilot ranking coverage matrix",
  "type": "object",
  "required": ["record_type", "edition", "generated_at", "streams"],
  "properties": {"record_type": {"const": "ranking_collection_pilot_coverage_matrix"}, "edition": {"type": "string", "minLength": 1}, "generated_at": {"type": "string", "minLength": 1}, "streams": {"type": "array", "minItems": 1, "items": {"type": "object"}}}
}
