{
  "record_type": "ranking_collection_pilot_coverage_matrix", "edition": "2026 Best Colleges", "generated_at": "2026-07-11T00:00:00+08:00",
  "streams": [
    {"stream_id": "business-accounting-batch-01", "expected_cutoff": "numeric_rank <= 20", "discovered_records": 1, "verified_records": 1, "partially_verified_records": 0, "unresolved_records": 0, "missing_ranks": "All other ranks <=20 and tie groups were not collected in Batch 1.", "ties_observed": 0, "tie_coverage": "unknown beyond collected record", "source_count": 1, "official_source_count": 0, "university_official_cross_source_count": 1, "identity_resolved_count": 1, "identity_unresolved_count": 0, "complete_cutoff_coverage": false},
    {"stream_id": "business-analytics-batch-01", "expected_cutoff": "numeric_rank <= 20", "discovered_records": 1, "verified_records": 1, "partially_verified_records": 0, "unresolved_records": 0, "missing_ranks": "All other ranks <=20 and tie groups were not collected in Batch 1.", "ties_observed": 0, "tie_coverage": "unknown beyond collected record", "source_count": 1, "official_source_count": 0, "university_official_cross_source_count": 1, "identity_resolved_count": 1, "identity_unresolved_count": 0, "complete_cutoff_coverage": false},
    {"stream_id": "business-management-information-systems-batch-01", "expected_cutoff": "numeric_rank <= 20", "discovered_records": 1, "verified_records": 1, "partially_verified_records": 0, "unresolved_records": 0, "missing_ranks": "All other ranks <=20 and tie groups were not collected in Batch 1.", "ties_observed": 0, "tie_coverage": "unknown beyond collected record", "source_count": 1, "official_source_count": 0, "university_official_cross_source_count": 1, "identity_resolved_count": 1, "identity_unresolved_count": 0, "complete_cutoff_coverage": false},
    {"stream_id": "business-production-operations-management-batch-01", "expected_cutoff": "numeric_rank <= 20", "discovered_records": 1, "verified_records": 1, "partially_verified_records": 0, "unresolved_records": 0, "missing_ranks": "All other ranks <=20 and tie groups were not collected in Batch 1.", "ties_observed": 0, "tie_coverage": "unknown beyond collected record", "source_count": 1, "official_source_count": 0, "university_official_cross_source_count": 1, "identity_resolved_count": 1, "identity_unresolved_count": 0, "complete_cutoff_coverage": false},
    {"stream_id": "business-management-batch-01", "expected_cutoff": "numeric_rank <= 20", "discovered_records": 1, "verified_records": 1, "partially_verified_records": 0, "unresolved_records": 0, "missing_ranks": "All other ranks <=20 and tie groups were not collected in Batch 1.", "ties_observed": 0, "tie_coverage": "unknown beyond collected record", "source_count": 1, "official_source_count": 0, "university_official_cross_source_count": 1, "identity_resolved_count": 1, "identity_unresolved_count": 0, "complete_cutoff_coverage": false},
    {"stream_id": "business-supply-chain-management-logistics-batch-01", "expected_cutoff": "numeric_rank <= 20", "discovered_records": 1, "verified_records": 1, "partially_verified_records": 0, "unresolved_records": 0, "missing_ranks": "All other ranks <=20 and tie groups were not collected in Batch 1.", "ties_observed": 0, "tie_coverage": "unknown beyond collected record", "source_count": 1, "official_source_count": 0, "university_official_cross_source_count": 1, "identity_resolved_count": 1, "identity_unresolved_count": 0, "complete_cutoff_coverage": false},
    {"stream_id": "business-real-estate-batch-01", "expected_cutoff": "numeric_rank <= 20", "discovered_records": 1, "verified_records": 1, "partially_verified_records": 0, "unresolved_records": 0, "missing_ranks": "All other ranks <=20 and tie groups were not collected in Batch 1.", "ties_observed": 0, "tie_coverage": "unknown beyond collected record", "source_count": 1, "official_source_count": 0, "university_official_cross_source_count": 1, "identity_resolved_count": 1, "identity_unresolved_count": 0, "complete_cutoff_coverage": false}
  ]
}
