{
  "record_type": "ranking_collection_pilot_coverage_matrix",
  "edition": "2026 Best Colleges",
  "generated_at": "2026-07-11T00:00:00+08:00",
  "streams": [
    {
      "stream_id": "undergraduate-engineering-doctorate-batch-02",
      "expected_cutoff": "numeric_rank <= 20",
      "discovered_records": 1,
      "verified_records": 1,
      "partially_verified_records": 0,
      "unresolved_records": 0,
      "missing_ranks": "All other ranks <=20 and tie groups were not collected in Batch 2.",
      "ties_observed": 0,
      "tie_coverage": "unknown beyond collected record",
      "source_count": 1,
      "official_source_count": 0,
      "university_official_cross_source_count": 1,
      "identity_resolved_count": 1,
      "identity_unresolved_count": 0,
      "complete_cutoff_coverage": false
    },
    {
      "stream_id": "engineering-biomedical-batch-02",
      "expected_cutoff": "numeric_rank <= 20",
      "discovered_records": 1,
      "verified_records": 1,
      "partially_verified_records": 0,
      "unresolved_records": 0,
      "missing_ranks": "All other ranks <=20 and tie groups were not collected in Batch 2.",
      "ties_observed": 0,
      "tie_coverage": "unknown beyond collected record",
      "source_count": 1,
      "official_source_count": 0,
      "university_official_cross_source_count": 1,
      "identity_resolved_count": 1,
      "identity_unresolved_count": 0,
      "complete_cutoff_coverage": false
    },
    {
      "stream_id": "engineering-chemical-batch-02",
      "expected_cutoff": "numeric_rank <= 20",
      "discovered_records": 1,
      "verified_records": 1,
      "partially_verified_records": 0,
      "unresolved_records": 0,
      "missing_ranks": "All other ranks <=20 and tie groups were not collected in Batch 2.",
      "ties_observed": 0,
      "tie_coverage": "unknown beyond collected record",
      "source_count": 1,
      "official_source_count": 0,
      "university_official_cross_source_count": 1,
      "identity_resolved_count": 1,
      "identity_unresolved_count": 0,
      "complete_cutoff_coverage": false
    },
    {
      "stream_id": "engineering-civil-batch-02",
      "expected_cutoff": "numeric_rank <= 20",
      "discovered_records": 1,
      "verified_records": 1,
      "partially_verified_records": 0,
      "unresolved_records": 0,
      "missing_ranks": "All other ranks <=20 and tie groups were not collected in Batch 2.",
      "ties_observed": 0,
      "tie_coverage": "unknown beyond collected record",
      "source_count": 1,
      "official_source_count": 0,
      "university_official_cross_source_count": 1,
      "identity_resolved_count": 1,
      "identity_unresolved_count": 0,
      "complete_cutoff_coverage": false
    },
    {
      "stream_id": "engineering-computer-batch-02",
      "expected_cutoff": "numeric_rank <= 20",
      "discovered_records": 1,
      "verified_records": 1,
      "partially_verified_records": 0,
      "unresolved_records": 0,
      "missing_ranks": "All other ranks <=20 and tie groups were not collected in Batch 2.",
      "ties_observed": 0,
      "tie_coverage": "unknown beyond collected record",
      "source_count": 1,
      "official_source_count": 0,
      "university_official_cross_source_count": 1,
      "identity_resolved_count": 1,
      "identity_unresolved_count": 0,
      "complete_cutoff_coverage": false
    },
    {
      "stream_id": "engineering-electrical-batch-02",
      "expected_cutoff": "numeric_rank <= 20",
      "discovered_records": 1,
      "verified_records": 1,
      "partially_verified_records": 0,
      "unresolved_records": 0,
      "missing_ranks": "All other ranks <=20 and tie groups were not collected in Batch 2.",
      "ties_observed": 0,
      "tie_coverage": "unknown beyond collected record",
      "source_count": 1,
      "official_source_count": 0,
      "university_official_cross_source_count": 1,
      "identity_resolved_count": 1,
      "identity_unresolved_count": 0,
      "complete_cutoff_coverage": false
    },
    {
      "stream_id": "engineering-environmental-batch-02",
      "expected_cutoff": "numeric_rank <= 20",
      "discovered_records": 1,
      "verified_records": 1,
      "partially_verified_records": 0,
      "unresolved_records": 0,
      "missing_ranks": "All other ranks <=20 and tie groups were not collected in Batch 2.",
      "ties_observed": 0,
      "tie_coverage": "unknown beyond collected record",
      "source_count": 1,
      "official_source_count": 0,
      "university_official_cross_source_count": 1,
      "identity_resolved_count": 1,
      "identity_unresolved_count": 0,
      "complete_cutoff_coverage": false
    },
    {
      "stream_id": "engineering-industrial-batch-02",
      "expected_cutoff": "numeric_rank <= 20",
      "discovered_records": 1,
      "verified_records": 1,
      "partially_verified_records": 0,
      "unresolved_records": 0,
      "missing_ranks": "All other ranks <=20 and tie groups were not collected in Batch 2.",
      "ties_observed": 0,
      "tie_coverage": "unknown beyond collected record",
      "source_count": 1,
      "official_source_count": 0,
      "university_official_cross_source_count": 1,
      "identity_resolved_count": 1,
      "identity_unresolved_count": 0,
      "complete_cutoff_coverage": false
    },
    {
      "stream_id": "engineering-materials-batch-02",
      "expected_cutoff": "numeric_rank <= 20",
      "discovered_records": 1,
      "verified_records": 1,
      "partially_verified_records": 0,
      "unresolved_records": 0,
      "missing_ranks": "All other ranks <=20 and tie groups were not collected in Batch 2.",
      "ties_observed": 0,
      "tie_coverage": "unknown beyond collected record",
      "source_count": 1,
      "official_source_count": 0,
      "university_official_cross_source_count": 1,
      "identity_resolved_count": 1,
      "identity_unresolved_count": 0,
      "complete_cutoff_coverage": false
    },
    {
      "stream_id": "engineering-mechanical-batch-02",
      "expected_cutoff": "numeric_rank <= 20",
      "discovered_records": 1,
      "verified_records": 1,
      "partially_verified_records": 0,
      "unresolved_records": 0,
      "missing_ranks": "All other ranks <=20 and tie groups were not collected in Batch 2.",
      "ties_observed": 0,
      "tie_coverage": "unknown beyond collected record",
      "source_count": 1,
      "official_source_count": 0,
      "university_official_cross_source_count": 1,
      "identity_resolved_count": 1,
      "identity_unresolved_count": 0,
      "complete_cutoff_coverage": false
    }
  ]
}
