{
  "record_type": "ranking_collection_pilot_coverage_matrix",
  "edition": "2026 Best Colleges",
  "generated_at": "2026-07-11T00:00:00+08:00",
  "streams": [
    {
      "stream_id": "business-marketing-batch-03",
      "expected_cutoff": "numeric_rank <= 20",
      "discovered_records": 1,
      "verified_records": 1,
      "partially_verified_records": 0,
      "unresolved_records": 0,
      "missing_ranks": "All other ranks <=20 and tie groups were not collected in Batch 3.",
      "ties_observed": 0,
      "tie_coverage": "unknown",
      "source_count": 1,
      "official_source_count": 0,
      "university_official_cross_source_count": 1,
      "identity_resolved_count": 1,
      "identity_unresolved_count": 0,
      "complete_cutoff_coverage": false
    },
    {
      "stream_id": "business-entrepreneurship-batch-03",
      "expected_cutoff": "numeric_rank <= 20",
      "discovered_records": 0,
      "verified_records": 0,
      "partially_verified_records": 0,
      "unresolved_records": 0,
      "missing_ranks": "No lawful direct Top-20 evidence was found in the public sources reviewed for this sweep.",
      "ties_observed": 0,
      "tie_coverage": "unknown",
      "source_count": 0,
      "official_source_count": 0,
      "university_official_cross_source_count": 0,
      "identity_resolved_count": 0,
      "identity_unresolved_count": 0,
      "complete_cutoff_coverage": false,
      "no_verified_reason": "No lawful direct Top-20 evidence found; no seed created."
    },
    {
      "stream_id": "business-finance-batch-03",
      "expected_cutoff": "numeric_rank <= 20",
      "discovered_records": 0,
      "verified_records": 0,
      "partially_verified_records": 0,
      "unresolved_records": 0,
      "missing_ranks": "No lawful direct Top-20 evidence was found in the public sources reviewed for this sweep.",
      "ties_observed": 0,
      "tie_coverage": "unknown",
      "source_count": 0,
      "official_source_count": 0,
      "university_official_cross_source_count": 0,
      "identity_resolved_count": 0,
      "identity_unresolved_count": 0,
      "complete_cutoff_coverage": false,
      "no_verified_reason": "No lawful direct Top-20 evidence found; no seed created."
    },
    {
      "stream_id": "business-international-business-batch-03",
      "expected_cutoff": "numeric_rank <= 20",
      "discovered_records": 0,
      "verified_records": 0,
      "partially_verified_records": 0,
      "unresolved_records": 0,
      "missing_ranks": "No lawful direct Top-20 evidence was found in the public sources reviewed for this sweep.",
      "ties_observed": 0,
      "tie_coverage": "unknown",
      "source_count": 0,
      "official_source_count": 0,
      "university_official_cross_source_count": 0,
      "identity_resolved_count": 0,
      "identity_unresolved_count": 0,
      "complete_cutoff_coverage": false,
      "no_verified_reason": "No lawful direct Top-20 evidence found; no seed created."
    },
    {
      "stream_id": "undergraduate-engineering-no-doctorate-batch-03",
      "expected_cutoff": "numeric_rank <= 20",
      "discovered_records": 0,
      "verified_records": 0,
      "partially_verified_records": 0,
      "unresolved_records": 0,
      "missing_ranks": "No lawful direct Top-20 evidence was found in the public sources reviewed for this sweep.",
      "ties_observed": 0,
      "tie_coverage": "unknown",
      "source_count": 0,
      "official_source_count": 0,
      "university_official_cross_source_count": 0,
      "identity_resolved_count": 0,
      "identity_unresolved_count": 0,
      "complete_cutoff_coverage": false,
      "no_verified_reason": "No lawful direct Top-20 evidence found; no seed created."
    },
    {
      "stream_id": "undergraduate-computer-science-batch-03",
      "expected_cutoff": "numeric_rank <= 20",
      "discovered_records": 0,
      "verified_records": 0,
      "partially_verified_records": 0,
      "unresolved_records": 0,
      "missing_ranks": "No lawful direct Top-20 evidence was found in the public sources reviewed for this sweep.",
      "ties_observed": 0,
      "tie_coverage": "unknown",
      "source_count": 0,
      "official_source_count": 0,
      "university_official_cross_source_count": 0,
      "identity_resolved_count": 0,
      "identity_unresolved_count": 0,
      "complete_cutoff_coverage": false,
      "no_verified_reason": "No lawful direct Top-20 evidence found; no seed created."
    },
    {
      "stream_id": "undergraduate-nursing-batch-03",
      "expected_cutoff": "numeric_rank <= 20",
      "discovered_records": 0,
      "verified_records": 0,
      "partially_verified_records": 0,
      "unresolved_records": 0,
      "missing_ranks": "No lawful direct Top-20 evidence was found in the public sources reviewed for this sweep.",
      "ties_observed": 0,
      "tie_coverage": "unknown",
      "source_count": 0,
      "official_source_count": 0,
      "university_official_cross_source_count": 0,
      "identity_resolved_count": 0,
      "identity_unresolved_count": 0,
      "complete_cutoff_coverage": false,
      "no_verified_reason": "No lawful direct Top-20 evidence found; no seed created."
    },
    {
      "stream_id": "undergraduate-economics-batch-03",
      "expected_cutoff": "numeric_rank <= 20",
      "discovered_records": 0,
      "verified_records": 0,
      "partially_verified_records": 0,
      "unresolved_records": 0,
      "missing_ranks": "No lawful direct Top-20 evidence was found in the public sources reviewed for this sweep.",
      "ties_observed": 0,
      "tie_coverage": "unknown",
      "source_count": 0,
      "official_source_count": 0,
      "university_official_cross_source_count": 0,
      "identity_resolved_count": 0,
      "identity_unresolved_count": 0,
      "complete_cutoff_coverage": false,
      "no_verified_reason": "No lawful direct Top-20 evidence found; no seed created."
    },
    {
      "stream_id": "undergraduate-psychology-batch-03",
      "expected_cutoff": "numeric_rank <= 20",
      "discovered_records": 0,
      "verified_records": 0,
      "partially_verified_records": 0,
      "unresolved_records": 0,
      "missing_ranks": "No lawful direct Top-20 evidence was found in the public sources reviewed for this sweep.",
      "ties_observed": 0,
      "tie_coverage": "unknown",
      "source_count": 0,
      "official_source_count": 0,
      "university_official_cross_source_count": 0,
      "identity_resolved_count": 0,
      "identity_unresolved_count": 0,
      "complete_cutoff_coverage": false,
      "no_verified_reason": "No lawful direct Top-20 evidence found; no seed created."
    }
  ]
}
